[
  {
    "slug": "ai-agent-evolution-personal-to-enterprise",
    "category": "ai",
    "title": "AI Agent 的进化：从个人助手到企业智能中枢",
    "summary": "AI Agent 正经历从个人效率工具到企业级智能化解决方案的深刻变革。美团 CatPaw 平台展示了 AI Agent 在多端协作、行业深度融合、复杂任务自主执行方面的能力，并为企业提供了数字员工和托管服务。同时，LoHoSearch 基准的出现，标志着对 AI Agent 在复杂搜索和推理能力评测进入新阶段，预示着 Agent 技术将朝着更深层次的认知和自主化方向发展。",
    "tags": [
      "AI Agent",
      "大型语言模型",
      "企业智能化",
      "技术评测"
    ],
    "language": "zh",
    "headings": [
      "参考资料"
    ]
  },
  {
    "slug": "ai-agents-reshaping-internet-interaction-developer-future",
    "category": "ai",
    "title": "AI 代理的崛起：重塑互联网交互与开发者未来",
    "summary": "AI 代理正以前所未有的速度改变着互联网的交互方式。从搜索引擎到网站内容，AI 代理正在成为用户获取信息和执行任务的新途径。这不仅对网站所有者提出了新的挑战，也为开发者带来了新的机遇，尤其是在利用 Serverless 和 WebAssembly 等技术构建更智能、更高效的 AI 应用方面。",
    "tags": [
      "AI",
      "AI Agents",
      "Serverless",
      "WebAssembly"
    ],
    "language": "zh",
    "headings": [
      "参考资料"
    ]
  },
  {
    "slug": "ai-era-font-defense-moat-or-moon-in-water",
    "category": "ai",
    "title": "AI 时代的字体攻防：是“护城河”还是“水中月”？",
    "summary": "随着 AI 技术的飞速发展，内容创作者面临着 AI 盗用作品的风险。一些人尝试通过“反 AI 字体”来保护版权，但这种方法被认为效果有限且可能带来负面影响。本文探讨了反 AI 字体的技术局限、可访问性问题以及其在 AI 时代可能扮演的角色。",
    "tags": [
      "AI",
      "字体",
      "版权保护",
      "内容创作"
    ],
    "language": "zh",
    "headings": [
      "参考资料"
    ]
  },
  {
    "slug": "ai-greenhouse-effect-perception-to-action-gap",
    "category": "ai",
    "title": "AI 的“温室效应”：从感知到行动的鸿沟",
    "summary": "顶级多模态大模型在动态开放世界中面临严峻挑战。美团的MineExplorer评测基准揭示，模型在感知能力上表现尚可，但在需要长程规划、隐藏前置条件和持续探索的任务中，推理和行动能力出现显著断层。这不仅暴露了当前AI在“看见”到“行动”之间的鸿沟，也为具身智能等前沿领域的发展指明了方向。",
    "tags": [
      "AI",
      "多模态大模型",
      "具身智能",
      "评测基准"
    ],
    "language": "zh",
    "headings": [
      "参考资料"
    ]
  },
  {
    "slug": "ai-in-software-development-double-edged-sword",
    "category": "ai",
    "title": "AI 在软件开发中的双刃剑：安全隐患与效率革新",
    "summary": "AI 在软件开发领域展现出巨大潜力，但同时也带来了安全风险。本文探讨了 AI 驱动的代码生成、安全漏洞以及新型交互模式，揭示了 AI 在提升效率的同时，如何重塑开发者工作流并引发对代码可信度的思考。",
    "tags": [
      "AI",
      "软件开发",
      "安全",
      "效率"
    ],
    "language": "zh",
    "headings": [
      "AI 代码生成：效率的助推器与潜在的风险源",
      "新型 AI 交互模式：从指令到声明式设计",
      "AI 在软件开发中的未来：安全、可控与协同",
      "参考资料"
    ]
  },
  {
    "slug": "cloudflare-ai-data-exploration-intelligence-transformation",
    "category": "ai",
    "title": "AI 赋能数据探索：Cloudflare 的智能化转型",
    "summary": "Cloudflare正通过AI技术重塑其数据服务，推出Radar Researcher等工具，使用户能以自然语言探索海量互联网数据。同时，通过整合Workers AI与AI Gateway，构建统一的AI控制平面，旨在简化AI应用的开发与部署，预示着AI在网络安全和数据分析领域的深度融合。",
    "tags": [
      "AI",
      "Cloudflare",
      "数据探索",
      "自然语言处理"
    ],
    "language": "zh",
    "headings": [
      "参考资料"
    ]
  },
  {
    "slug": "ai-agents-from-greenhouse-to-open-world-challenges-and-new-e",
    "category": "engineering",
    "title": "AI智能体：从“温室”走向“开放世界”的挑战与评测新维度",
    "summary": "当前AI智能体在复杂、动态的开放世界中面临严峻挑战。美团开源的LoHoSearch和MineExplorer评测基准，分别聚焦搜索智能体和多模态大模型，揭示了它们在长程规划、隐藏前置条件处理及动态环境适应性上的能力断层。这些新基准强调了AI需要从静态知识图谱和固定场景中走出，去应对真实世界的复杂性。",
    "tags": [
      "AI",
      "智能体",
      "评测基准",
      "多模态大模型"
    ],
    "language": "zh",
    "headings": [
      "参考资料"
    ]
  },
  {
    "slug": "cf-workers-caching",
    "category": "engineering",
    "title": "Cloudflare Workers 多层缓存实践",
    "summary": "在边缘计算环境下用四层缓存把渲染成本压到最低。",
    "tags": [
      "cloudflare",
      "cache"
    ],
    "language": "zh",
    "headings": [
      "背景",
      "缓存分层",
      "失效策略",
      "注意事项",
      "结论"
    ]
  },
  {
    "slug": "react-server-components",
    "category": "engineering",
    "title": "Understanding React Server Components",
    "summary": "What RSC actually changes about data fetching and bundle size.",
    "tags": [
      "react",
      "nextjs",
      "frontend"
    ],
    "language": "en",
    "headings": [
      "Why RSC",
      "Trade-offs"
    ]
  },
  {
    "slug": "meituan-ai-agent-evolution-catpaw-kdd-cup",
    "category": "engineering",
    "title": "美团AI Agent的演进：从CatPaw到KDD Cup的智能体竞赛",
    "summary": "美团正通过CatPaw全场景AI Agent平台和在KDD Cup等竞赛中的实践，推动AI技术在个人提效和企业智能化方面的落地。CatPaw集成了强大的大模型能力和本地生活服务领域知识，而KDD Cup的参赛经验则加速了数据智能体在复杂异构数据分析中的自主推理能力。",
    "tags": [
      "AI Agent",
      "大模型",
      "美团",
      "KDD Cup"
    ],
    "language": "zh",
    "headings": [
      "参考资料"
    ]
  },
  {
    "slug": "weekly-001",
    "category": "weekly",
    "title": "第 1 期",
    "summary": "本期 20 条：工程实践 5 · 工具与生态 6 · 行业动态 9",
    "tags": [],
    "language": "zh",
    "headings": [
      "工程实践",
      "工具与生态",
      "行业动态"
    ]
  },
  {
    "slug": "weekly-002",
    "category": "weekly",
    "title": "第 2 期",
    "summary": "本期 29 条：工程实践 11 · 工具与生态 10 · 系统设计 1 · 行业动态 3 · 其他 4",
    "tags": [],
    "language": "zh",
    "headings": [
      "工程实践",
      "工具与生态",
      "系统设计",
      "行业动态",
      "其他"
    ]
  }
]